03:07:32.116438 ARP, Request who-has 10.252.16.33 (Broadcast) tell 10.252.23.249, length 46
03:07:32.622430 ARP, Request who-has 10.252.16.33 (Broadcast) tell 10.252.23.248, length 46
03:07:32.675185 IP iZ28gppexo6Z.55133 > 10.202.72.118.domain: 6295+ PTR? 33.16.252.10.in-addr.arpa. (43)
03:07:32.675547 IP 10.202.72.118.domain > iZ28gppexo6Z.55133: 6295 NXDomain* 0/1/0 (93)
03:07:32.675745 IP iZ28gppexo6Z.47004 > 10.202.72.116.domain: 63652+ PTR? 249.23.252.10.in-addr.arpa. (44)
03:07:32.678634 IP 10.202.72.116.domain > iZ28gppexo6Z.47004: 63652 NXDomain* 0/1/0 (94)
03:07:32.678819 IP iZ28gppexo6Z.48981 > 10.202.72.116.domain: 41117+ PTR? 248.23.252.10.in-addr.arpa. (44)
03:07:32.679199 IP 10.202.72.116.domain > iZ28gppexo6Z.48981: 41117 NXDomain* 0/1/0 (94)
03:07:32.762159 ARP, Request who-has 10.163.115.209 (Broadcast) tell 10.163.127.248, length 46
03:07:33.680610 IP iZ28gppexo6Z.37061 > 10.202.72.118.domain: 22+ PTR? 118.72.202.10.in-addr.arpa. (44)
03:07:33.680982 IP 10.202.72.118.domain > iZ28gppexo6Z.37061: 22 NXDomain* 0/1/0 (94)
03:07:33.681275 IP iZ28gppexo6Z.35666 > 10.202.72.116.domain: 60991+ PTR? 116.72.202.10.in-addr.arpa. (44)
03:07:33.681583 IP 10.202.72.116.domain > iZ28gppexo6Z.35666: 60991 NXDomain* 0/1/0 (94)
03:07:33.681798 IP iZ28gppexo6Z.54254 > 10.202.72.116.domain: 7684+ PTR? 209.115.163.10.in-addr.arpa. (45)
03:07:33.682216 IP 10.202.72.116.domain > iZ28gppexo6Z.54254: 7684 NXDomain* 0/1/0 (95)
03:07:33.682405 IP iZ28gppexo6Z.54844 > 10.202.72.116.domain: 50392+ PTR? 248.127.163.10.in-addr.arpa. (45)
03:07:33.682735 IP 10.202.72.116.domain > iZ28gppexo6Z.54844: 50392 NXDomain* 0/1/0 (95)
03:07:33.984893 ARP, Request who-has 169.254.169.254 tell 10.163.124.113, length 42
03:07:34.129890 ARP, Request who-has 10.252.16.33 (Broadcast) tell 10.252.23.249, length 46
03:07:34.684270 IP iZ28gppexo6Z.60201 > 10.202.72.118.domain: 2174+ PTR? 254.169.254.169.in-addr.arpa. (46)
03:07:34.684659 IP 10.202.72.118.domain > iZ28gppexo6Z.60201: 2174 NXDomain* 0/1/0 (101)
03:07:34.684872 IP iZ28gppexo6Z.46624 > 10.202.72.118.domain: 59589+ PTR? 113.124.163.10.in-addr.arpa. (45)
03:07:34.685193 IP 10.202.72.118.domain > iZ28gppexo6Z.46624: 59589 NXDomain* 0/1/0 (95)
03:07:34.990845 ARP, Request who-has 169.254.169.254 tell 10.163.124.113, length 42
03:07:35.156701 ARP, Request who-has 169.254.137.47 tell 10.252.28.10, length 42
03:07:35.665625 ARP, Request who-has 10.163.111.247 tell 10.163.101.2, length 28
03:07:35.686618 IP iZ28gppexo6Z.39071 > 10.202.72.116.domain: 27845+ PTR? 47.137.254.169.in-addr.arpa. (45)
03:07:35.687002 IP 10.202.72.116.domain > iZ28gppexo6Z.39071: 27845 NXDomain* 0/1/0 (100)
03:07:35.687202 IP iZ28gppexo6Z.34853 > 10.202.72.118.domain: 22258+ PTR? 10.28.252.10.in-addr.arpa. (43)
03:07:35.687539 IP 10.202.72.118.domain > iZ28gppexo6Z.34853: 22258 NXDomain* 0/1/0 (93)
03:07:35.687718 IP iZ28gppexo6Z.59264 > 10.202.72.118.domain: 58942+ PTR? 247.111.163.10.in-addr.arpa. (45)
03:07:35.688085 IP 10.202.72.118.domain > iZ28gppexo6Z.59264: 58942 NXDomain* 0/1/0 (95)
03:07:35.688248 IP iZ28gppexo6Z.52457 > 10.202.72.118.domain: 38946+ PTR? 2.101.163.10.in-addr.arpa. (43)
03:07:35.688605 IP 10.202.72.118.domain > iZ28gppexo6Z.52457: 38946 NXDomain* 0/1/0 (93)
03:07:36.006523 ARP, Request who-has 169.254.169.254 tell 10.163.124.113, length 42
03:07:36.126101 ARP, Request who-has 169.254.137.47 tell 10.252.28.10, length 42
03:07:36.662504 ARP, Request who-has 10.252.19.1 (Broadcast) tell 10.252.23.248, length 46
03:07:36.690045 IP iZ28gppexo6Z.35428 > 10.202.72.116.domain: 42525+ PTR? 1.19.252.10.in-addr.arpa. (42)
03:07:36.690462 IP 10.202.72.116.domain > iZ28gppexo6Z.35428: 42525 NXDomain* 0/1/0 (92)
03:07:36.840019 IP iZ28gppexo6Z.ntp > 100.100.3.1.ntp: NTPv4, Client, length 48
03:07:37.125545 ARP, Request who-has 169.254.137.47 tell 10.252.28.10, length 42
03:07:37.671267 ARP, Request who-has 10.252.23.247 tell 10.252.21.209, length 42
03:07:37.681064 ARP, Request who-has 10.163.111.247 tell iZ28gppexo6Z, length 28
03:07:37.682651 ARP, Reply 10.163.111.247 is-at 00:00:0c:9f:f2:c4 (oui Cisco), length 46
03:07:38.159900 ARP, Request who-has 10.252.16.33 (Broadcast) tell 10.252.23.249, length 46
03:07:38.197713 ARP, Request who-has 10.252.17.245 (Broadcast) tell 10.252.23.249, length 46
03:07:38.672700 IP iZ28gppexo6Z.34228 > 10.202.72.116.domain: 17548+ PTR? 247.23.252.10.in-addr.arpa. (44)
03:07:38.673081 IP 10.202.72.116.domain > iZ28gppexo6Z.34228: 17548 NXDomain* 0/1/0 (94)
03:07:38.673319 IP iZ28gppexo6Z.55268 > 10.202.72.118.domain: 60423+ PTR? 209.21.252.10.in-addr.arpa. (44)
03:07:38.673644 IP 10.202.72.118.domain > iZ28gppexo6Z.55268: 60423 NXDomain* 0/1/0 (94)
03:07:38.673863 IP iZ28gppexo6Z.58145 > 10.202.72.116.domain: 58071+ PTR? 245.17.252.10.in-addr.arpa. (44)
03:07:38.674169 IP 10.202.72.116.domain > iZ28gppexo6Z.58145: 58071 NXDomain* 0/1/0 (94)
03:07:38.692954 ARP, Request who-has 10.163.113.18 tell 10.163.113.15, length 42
03:07:39.054868 ARP, Request who-has 10.252.23.247 tell 10.252.19.239, length 42
03:07:39.182081 ARP, Request who-has 10.252.26.241 tell 10.252.26.99, length 42
03:07:39.374945 ARP, Request who-has 10.163.125.67 (Broadcast) tell 10.163.127.248, length 46
03:07:39.675570 IP iZ28gppexo6Z.48932 > 10.202.72.116.domain: 7423+ PTR? 18.113.163.10.in-addr.arpa. (44)
03:07:39.675968 IP 10.202.72.116.domain > iZ28gppexo6Z.48932: 7423 NXDomain* 0/1/0 (94)
03:07:39.676162 IP iZ28gppexo6Z.46812 > 10.202.72.116.domain: 32332+ PTR? 15.113.163.10.in-addr.arpa. (44)
03:07:39.676528 IP 10.202.72.116.domain > iZ28gppexo6Z.46812: 32332 NXDomain* 0/1/0 (94)
03:07:39.676699 IP iZ28gppexo6Z.49497 > 10.202.72.118.domain: 59548+ PTR? 239.19.252.10.in-addr.arpa. (44)
03:07:39.677045 IP 10.202.72.118.domain > iZ28gppexo6Z.49497: 59548 NXDomain* 0/1/0 (94)
03:07:39.677243 IP iZ28gppexo6Z.52143 > 10.202.72.118.domain: 54944+ PTR? 241.26.252.10.in-addr.arpa. (44)
03:07:39.677567 IP 10.202.72.118.domain > iZ28gppexo6Z.52143: 54944 NXDomain* 0/1/0 (94)
03:07:39.677724 IP iZ28gppexo6Z.47598 > 10.202.72.116.domain: 2618+ PTR? 99.26.252.10.in-addr.arpa. (43)
03:07:39.678042 IP 10.202.72.116.domain > iZ28gppexo6Z.47598: 2618 NXDomain* 0/1/0 (93)
03:07:39.678210 IP iZ28gppexo6Z.56840 > 10.202.72.118.domain: 31809+ PTR? 67.125.163.10.in-addr.arpa. (44)
03:07:39.678534 IP 10.202.72.118.domain > iZ28gppexo6Z.56840: 31809 NXDomain* 0/1/0 (94)
03:07:39.751321 ARP, Request who-has 10.163.104.39 (Broadcast) tell 10.163.111.248, length 46
03:07:39.805901 ARP, Request who-has 169.254.169.254 tell 10.252.18.221, length 42
03:07:40.204128 ARP, Request who-has 10.252.17.245 (Broadcast) tell 10.252.23.249, length 46
03:07:40.412303 ARP, Request who-has 10.252.23.247 tell 10.252.22.118, length 42
03:07:40.553798 ARP, Request who-has 10.252.20.57 (Broadcast) tell 10.252.23.249, length 46
03:07:40.679972 IP iZ28gppexo6Z.55027 > 10.202.72.118.domain: 16011+ PTR? 39.104.163.10.in-addr.arpa. (44)
03:07:40.680324 IP 10.202.72.118.domain > iZ28gppexo6Z.55027: 16011 NXDomain* 0/1/0 (94)
03:07:40.680511 IP iZ28gppexo6Z.52588 > 10.202.72.118.domain: 18476+ PTR? 248.111.163.10.in-addr.arpa. (45)
03:07:40.680833 IP 10.202.72.118.domain > iZ28gppexo6Z.52588: 18476 NXDomain* 0/1/0 (95)
03:07:40.680997 IP iZ28gppexo6Z.47075 > 10.202.72.116.domain: 35525+ PTR? 221.18.252.10.in-addr.arpa. (44)
03:07:40.681304 IP 10.202.72.116.domain > iZ28gppexo6Z.47075: 35525 NXDomain* 0/1/0 (94)
03:07:40.681470 IP iZ28gppexo6Z.42403 > 10.202.72.116.domain: 13463+ PTR? 118.22.252.10.in-addr.arpa. (44)
03:07:40.681801 IP 10.202.72.116.domain > iZ28gppexo6Z.42403: 13463 NXDomain* 0/1/0 (94)
03:07:40.681966 IP iZ28gppexo6Z.40609 > 10.202.72.118.domain: 19678+ PTR? 57.20.252.10.in-addr.arpa. (43)
03:07:40.682290 IP 10.202.72.118.domain > iZ28gppexo6Z.40609: 19678 NXDomain* 0/1/0 (93)
03:07:40.805555 ARP, Request who-has 169.254.169.254 tell 10.252.18.221, length 42
03:07:41.149698 ARP, Request who-has 10.252.20.127 (Broadcast) tell 10.252.23.249, length 46
03:07:41.151667 ARP, Request who-has 10.163.108.180 (Broadcast) tell 10.163.111.249, length 46
03:07:41.382117 ARP, Request who-has 10.163.125.67 (Broadcast) tell 10.163.127.248, length 46
03:07:41.553785 ARP, Request who-has 10.163.108.180 (Broadcast) tell 10.163.111.248, length 46
03:07:41.591464 ARP, Request who-has 10.252.20.57 (Broadcast) tell 10.252.23.248, length 46

